{
  "template_family_id": "TF-DELIVERY-STATE-TRACE",
  "version": "2.0.0",
  "status": "frozen_template_family",
  "claim_ids": [
    "CL-BENCH-RECOVERY"
  ],
  "capability_cell_ids": [
    "BC-RECOVERY-03",
    "BC-V2-DELIVERY-01"
  ],
  "mechanism_family": "delivery_state_transition",
  "complexity_level": "L4",
  "experiment_unit": {
    "unit_type": "temporal_trace",
    "relation_id": "REL-DELIVERY-STATE-TRACE",
    "minimum_members": 2,
    "relation_assertions": [
      {
        "assertion_id": "ASSERT-DELIVERY-STATE-TRACE",
        "kind": "temporal_transition",
        "left_path": "$.task_state.tasks[0].delivery_history[0].state",
        "operator": "transitions_to"
      }
    ]
  },
  "provenance": {
    "design_id": "fusionagent.benchmark-design.v1",
    "charter_id": "fusionagent.benchmark-charter.v1",
    "matrix_id": "fusionagent.benchmark-capability-matrix.v1",
    "kg_release_id": "fusionagent-kg-v1.0.0",
    "kg_semantic_hash": "sha256:50067b9368914c47580707650789c04c78b2e856ccb3ef4d120a31f36c0ad71e",
    "authoring_basis": [
      "approved-v2-candidate-semantics",
      "tf-delivery-state-trace"
    ],
    "historical_case_similarity_review": "reviewed against the frozen exclusion registry; no semantic copy admitted"
  },
  "task_state": {
    "disaster_type": "flood",
    "resource_regime": "bounded_development_authoring",
    "tasks": [
      {
        "task_id": "TASK-WATER-POLYGON",
        "task_kind": "water_polygon",
        "contract_ids": [
          "contract.product.water_polygon.v1"
        ],
        "source_states": [
          {
            "source_id": "catalog.flood.water_polygon",
            "availability": "available",
            "semantic_status": "compatible",
            "legal_for_task": true
          },
          {
            "source_id": "raw.osm.water",
            "availability": "available",
            "semantic_status": "compatible",
            "legal_for_task": true
          },
          {
            "source_id": "raw.hydrolakes.water",
            "availability": "available",
            "semantic_status": "compatible",
            "legal_for_task": true
          }
        ],
        "observed_failures": [],
        "delivery_history": [
          {
            "step": 1,
            "state": "provisional",
            "evidence_ref": "authoring://delivery/water_polygon"
          }
        ],
        "precedence_after": []
      }
    ],
    "global_observations": {
      "mission_priority": [
        "TASK-WATER-POLYGON"
      ],
      "time_budget_class": "standard",
      "network_state": "online"
    }
  },
  "variables": {
    "causal_variables": [
      {
        "variable_id": "VAR-LATEST-DELIVERY-STATE",
        "json_path": "$.v2_extensions.delivery[0].to_state",
        "value_type": "string",
        "allowed_values": [
          "pending",
          "gap",
          "provisional",
          "degraded",
          "final",
          "superseded"
        ],
        "mutation_role": "causal"
      }
    ],
    "invariants": [
      {
        "variable_id": "VAR-CONTRACT",
        "json_path": "$.task_state.tasks[0].contract_ids",
        "value_type": "array",
        "allowed_values": [
          [
            "contract.product.water_polygon.v1"
          ]
        ],
        "mutation_role": "invariant"
      },
      {
        "variable_id": "VAR-SOURCE-STATE",
        "json_path": "$.task_state.tasks[0].source_states",
        "value_type": "array",
        "allowed_values": [
          [
            {
              "source_id": "catalog.flood.water_polygon",
              "availability": "available",
              "semantic_status": "compatible",
              "legal_for_task": true
            },
            {
              "source_id": "raw.osm.water",
              "availability": "available",
              "semantic_status": "compatible",
              "legal_for_task": true
            },
            {
              "source_id": "raw.hydrolakes.water",
              "availability": "available",
              "semantic_status": "compatible",
              "legal_for_task": true
            }
          ]
        ],
        "mutation_role": "invariant"
      },
      {
        "variable_id": "VAR-FAILURE-HISTORY",
        "json_path": "$.task_state.tasks[0].observed_failures",
        "value_type": "array",
        "allowed_values": [
          []
        ],
        "mutation_role": "invariant"
      }
    ],
    "nuisance_variables": [
      {
        "variable_id": "VAR-EVIDENCE-ORDER",
        "json_path": "$.v2_extensions.delivery[0].evidence_refs",
        "value_type": "array",
        "allowed_values": [
          [
            {
              "evidence_type": "planning_decision",
              "ref": "authoring://planning_decision/water_polygon"
            },
            {
              "evidence_type": "quality_report",
              "ref": "authoring://quality_report/water_polygon"
            },
            {
              "evidence_type": "artifact_lineage",
              "ref": "authoring://artifact_lineage/water_polygon"
            }
          ]
        ],
        "mutation_role": "nuisance"
      }
    ],
    "maximum_causal_mutations_per_pair": 1
  },
  "oracle": {
    "allowed_decisions": [
      "plan"
    ],
    "task_constraints": [
      {
        "task_id": "TASK-WATER-POLYGON",
        "required": true,
        "allowed_delivery_states": [
          "provisional"
        ],
        "allowed_source_ids": [
          "catalog.flood.water_polygon",
          "raw.osm.water",
          "raw.hydrolakes.water"
        ],
        "forbidden_source_ids": []
      }
    ],
    "relation_assertion_ids": [
      "ASSERT-DELIVERY-STATE-TRACE"
    ],
    "manual_review_item_ids": [
      "REVIEW-DELIVERY-STATE-TRACE-SEMANTICS"
    ],
    "allows_multiple_valid_plans": false
  },
  "vetoes": [
    {
      "veto_id": "VETO-DELIVERY-STATE-TRACE",
      "failure_class": "authoring.delivery_state_trace",
      "condition": "gap_to_final_without_evidence; failed_to_final_without_quality_report; silent_final; invalid_transition",
      "evidence_path": "$.task_state.tasks"
    }
  ],
  "views": {
    "planner_visible_paths": [
      "$.task_state"
    ],
    "evaluator_only_paths": [
      "$.oracle"
    ],
    "human_blind_paths": [
      "$.task_state"
    ],
    "planner_forbidden_path_prefixes": [
      "$.oracle",
      "$.vetoes",
      "$.experiment_unit.relation_assertions",
      "$.partition_policy",
      "$.hashing"
    ]
  },
  "crosswalk": {
    "kg_release_id": "fusionagent-kg-v1.0.0",
    "references": [
      {
        "reference_id": "contract.product.water_polygon.v1",
        "reference_type": "contract",
        "used_by_task_ids": [
          "TASK-WATER-POLYGON"
        ]
      },
      {
        "reference_id": "catalog.flood.water_polygon",
        "reference_type": "source",
        "used_by_task_ids": [
          "TASK-WATER-POLYGON"
        ]
      },
      {
        "reference_id": "raw.osm.water",
        "reference_type": "source",
        "used_by_task_ids": [
          "TASK-WATER-POLYGON"
        ]
      },
      {
        "reference_id": "raw.hydrolakes.water",
        "reference_type": "source",
        "used_by_task_ids": [
          "TASK-WATER-POLYGON"
        ]
      },
      {
        "reference_id": "algo.fusion.water_polygon.priority_merge.v2",
        "reference_type": "algorithm",
        "used_by_task_ids": [
          "TASK-WATER-POLYGON"
        ]
      },
      {
        "reference_id": "quality.default.water_polygon.v1",
        "reference_type": "quality_policy",
        "used_by_task_ids": [
          "TASK-WATER-POLYGON"
        ]
      }
    ],
    "missing_reference_policy": "fail_closed"
  },
  "partition_policy": {
    "allowed_partitions": [
      "development"
    ],
    "historical_case_ids_forbidden_in_confirmation": [
      "C01",
      "C02",
      "C03",
      "C04",
      "C05",
      "C06",
      "H01",
      "H02",
      "H03",
      "H04",
      "H05",
      "H06",
      "H07",
      "H08",
      "H09"
    ],
    "semantic_copy_forbidden": true
  },
  "generation": {
    "generator_id": "generator.method-selection-authoring.v2-candidate",
    "template_first": true,
    "seed_namespace": "fusionagent-benchmark-v1-development",
    "instance_id_pattern": "^BDV1-DEV-BC-[A-Z0-9-]+-[0-9]{3}$",
    "stopping_rule_id": "stop.pre-registered-development-budget.v1"
  },
  "hashing": {
    "algorithm": "sha256",
    "canonicalization": "utf8-json-sorted-keys-compact-no-bom",
    "template_hash_field": "template_sha256",
    "instance_hash_field": "instance_sha256"
  },
  "e2e_eligibility": {
    "eligible": true,
    "source_closed_required": true,
    "truth_or_quality_evaluable_required": true,
    "selection_independent_of_method_result": true
  }
}
