{
  "template_family_id": "TF-SOURCE-AVAILABILITY",
  "version": "1.0.0",
  "status": "frozen_template_family",
  "claim_ids": [
    "CL-BENCH-CAUSAL"
  ],
  "capability_cell_ids": [
    "BC-CAUSAL-02"
  ],
  "mechanism_family": "source_availability",
  "complexity_level": "L1",
  "experiment_unit": {
    "unit_type": "counterfactual_pair",
    "relation_id": "REL-SOURCE-AVAILABILITY",
    "minimum_members": 2,
    "relation_assertions": [
      {
        "assertion_id": "ASSERT-SOURCE-AVAILABILITY",
        "kind": "causal_change",
        "left_path": "$.task_state.tasks[0].source_states[1].availability",
        "operator": "not_equals"
      }
    ]
  },
  "provenance": {
    "design_id": "fusionagent.benchmark-design.v1",
    "charter_id": "fusionagent.benchmark-charter.v1",
    "matrix_id": "fusionagent.benchmark-capability-matrix.v1",
    "kg_release_id": "fusionagent-kg-v1.0.0",
    "kg_semantic_hash": "sha256:50067b9368914c47580707650789c04c78b2e856ccb3ef4d120a31f36c0ad71e",
    "authoring_basis": [
      "approved-v2-candidate-semantics",
      "tf-source-availability"
    ],
    "historical_case_similarity_review": "reviewed against the frozen exclusion registry; no semantic copy admitted"
  },
  "task_state": {
    "disaster_type": "generic",
    "resource_regime": "bounded_development_authoring",
    "tasks": [
      {
        "task_id": "TASK-POI",
        "task_kind": "poi",
        "contract_ids": [
          "contract.product.poi.v1"
        ],
        "source_states": [
          {
            "source_id": "catalog.generic.poi",
            "availability": "available",
            "semantic_status": "compatible",
            "legal_for_task": true
          },
          {
            "source_id": "raw.osm.poi",
            "availability": "delayed",
            "semantic_status": "compatible",
            "legal_for_task": true
          },
          {
            "source_id": "raw.gns.poi",
            "availability": "available",
            "semantic_status": "compatible",
            "legal_for_task": true
          },
          {
            "source_id": "raw.google.poi",
            "availability": "available",
            "semantic_status": "compatible",
            "legal_for_task": true
          }
        ],
        "observed_failures": [],
        "delivery_history": [
          {
            "step": 1,
            "state": "planned",
            "evidence_ref": "authoring://delivery/poi"
          }
        ],
        "precedence_after": []
      }
    ],
    "global_observations": {
      "mission_priority": [
        "TASK-POI"
      ],
      "time_budget_class": "standard",
      "network_state": "online"
    }
  },
  "variables": {
    "causal_variables": [
      {
        "variable_id": "VAR-SOURCE-AVAILABILITY",
        "json_path": "$.task_state.tasks[0].source_states[1].availability",
        "value_type": "string",
        "allowed_values": [
          "available",
          "delayed",
          "missing",
          "failed"
        ],
        "mutation_role": "causal"
      }
    ],
    "invariants": [
      {
        "variable_id": "VAR-TASK-KIND",
        "json_path": "$.task_state.tasks[0].task_kind",
        "value_type": "string",
        "allowed_values": [
          "poi"
        ],
        "mutation_role": "invariant"
      },
      {
        "variable_id": "VAR-CONTRACT",
        "json_path": "$.task_state.tasks[0].contract_ids",
        "value_type": "array",
        "allowed_values": [
          [
            "contract.product.poi.v1"
          ]
        ],
        "mutation_role": "invariant"
      },
      {
        "variable_id": "VAR-SOURCE-SEMANTICS",
        "json_path": "$.task_state.tasks[0].source_states",
        "value_type": "array",
        "allowed_values": [
          [
            {
              "source_id": "catalog.generic.poi",
              "availability": "available",
              "semantic_status": "compatible",
              "legal_for_task": true
            },
            {
              "source_id": "raw.osm.poi",
              "availability": "delayed",
              "semantic_status": "compatible",
              "legal_for_task": true
            },
            {
              "source_id": "raw.gns.poi",
              "availability": "available",
              "semantic_status": "compatible",
              "legal_for_task": true
            },
            {
              "source_id": "raw.google.poi",
              "availability": "available",
              "semantic_status": "compatible",
              "legal_for_task": true
            }
          ]
        ],
        "mutation_role": "invariant"
      }
    ],
    "nuisance_variables": [],
    "maximum_causal_mutations_per_pair": 1
  },
  "oracle": {
    "allowed_decisions": [
      "plan"
    ],
    "task_constraints": [
      {
        "task_id": "TASK-POI",
        "required": true,
        "allowed_delivery_states": [
          "planned"
        ],
        "allowed_source_ids": [
          "catalog.generic.poi",
          "raw.osm.poi",
          "raw.gns.poi",
          "raw.google.poi"
        ],
        "forbidden_source_ids": []
      }
    ],
    "relation_assertion_ids": [
      "ASSERT-SOURCE-AVAILABILITY"
    ],
    "manual_review_item_ids": [
      "REVIEW-SOURCE-AVAILABILITY-SEMANTICS"
    ],
    "allows_multiple_valid_plans": true
  },
  "vetoes": [
    {
      "veto_id": "VETO-SOURCE-AVAILABILITY",
      "failure_class": "authoring.source_availability",
      "condition": "manual_preload_as_remote_success; optional_as_required; unknown_source",
      "evidence_path": "$.task_state.tasks"
    }
  ],
  "views": {
    "planner_visible_paths": [
      "$.task_state"
    ],
    "evaluator_only_paths": [
      "$.oracle"
    ],
    "human_blind_paths": [
      "$.task_state"
    ],
    "planner_forbidden_path_prefixes": [
      "$.oracle",
      "$.vetoes",
      "$.experiment_unit.relation_assertions",
      "$.partition_policy",
      "$.hashing"
    ]
  },
  "crosswalk": {
    "kg_release_id": "fusionagent-kg-v1.0.0",
    "references": [
      {
        "reference_id": "contract.product.poi.v1",
        "reference_type": "contract",
        "used_by_task_ids": [
          "TASK-POI"
        ]
      },
      {
        "reference_id": "catalog.generic.poi",
        "reference_type": "source",
        "used_by_task_ids": [
          "TASK-POI"
        ]
      },
      {
        "reference_id": "raw.osm.poi",
        "reference_type": "source",
        "used_by_task_ids": [
          "TASK-POI"
        ]
      },
      {
        "reference_id": "raw.gns.poi",
        "reference_type": "source",
        "used_by_task_ids": [
          "TASK-POI"
        ]
      },
      {
        "reference_id": "raw.google.poi",
        "reference_type": "source",
        "used_by_task_ids": [
          "TASK-POI"
        ]
      },
      {
        "reference_id": "algo.fusion.poi.v1",
        "reference_type": "algorithm",
        "used_by_task_ids": [
          "TASK-POI"
        ]
      },
      {
        "reference_id": "algo.fusion.poi.geohash_neighbor_match.v1",
        "reference_type": "algorithm",
        "used_by_task_ids": [
          "TASK-POI"
        ]
      },
      {
        "reference_id": "quality.default.poi.v1",
        "reference_type": "quality_policy",
        "used_by_task_ids": [
          "TASK-POI"
        ]
      }
    ],
    "missing_reference_policy": "fail_closed"
  },
  "partition_policy": {
    "allowed_partitions": [
      "development"
    ],
    "historical_case_ids_forbidden_in_confirmation": [
      "C01",
      "C02",
      "C03",
      "C04",
      "C05",
      "C06",
      "H01",
      "H02",
      "H03",
      "H04",
      "H05",
      "H06",
      "H07",
      "H08",
      "H09"
    ],
    "semantic_copy_forbidden": true
  },
  "generation": {
    "generator_id": "generator.method-selection-authoring.v2-candidate",
    "template_first": true,
    "seed_namespace": "fusionagent-benchmark-v1-development",
    "instance_id_pattern": "^BDV1-DEV-BC-[A-Z0-9-]+-[0-9]{3}$",
    "stopping_rule_id": "stop.pre-registered-development-budget.v1"
  },
  "hashing": {
    "algorithm": "sha256",
    "canonicalization": "utf8-json-sorted-keys-compact-no-bom",
    "template_hash_field": "template_sha256",
    "instance_hash_field": "instance_sha256"
  }
}
